Id,Name,Price,Category,Stock_status,Availability
cf2f27fdf94ba20e,"The Lonely Ones",£43.59,Childrens,"In stock","3 available"
70c7c3ca7f9b2728,"The Lean Startup: How Today's Entrepreneurs Use Continuous Innovation to Create Radically Successful Businesses",£33.92,Business,"In stock","3 available"
476c7972e9b41891,"The Last Painting of Sara de Vos",£55.55,"Historical Fiction","In stock","3 available"
35e69a79d2b1e804,"The Land of 10,000 Madonnas",£29.64,"Young Adult","In stock","3 available"
554e9e2d532b3a87,"The Infinities",£27.41,Fiction,"In stock","3 available"
ff6bb30dd0c482a6,"The Husband's Secret",£52.51,Fiction,"In stock","3 available"
a8b0ea6490bc818f,"The Hitchhiker's Guide to the Galaxy (Hitchhiker's Guide to the Galaxy #1)",£47.80,"Add a comment","In stock","3 available"
b5da59dd177eb36b,"The Guns of August",£14.54,History,"In stock","3 available"
4a0a276409968a73,"The Guernsey Literary and Potato Peel Pie Society",£49.53,"Historical Fiction","In stock","3 available"
c88422d8959260ab,"The Goldfinch",£43.58,Default,"In stock","3 available"
e2dac1f4739e0bd5,"The Giver (The Giver Quartet #1)",£12.30,Default,"In stock","3 available"
92dcc54a27107a37,"The Girl with All the Gifts",£49.47,Horror,"In stock","3 available"
bfa9cb304075d3e8,"The Girl Who Played with Fire (Millennium Trilogy #2)",£22.14,Default,"In stock","3 available"
8f5d16a5a9bd58b2,"The Girl Who Kicked the Hornet's Nest (Millennium Trilogy #3)",£57.48,"Add a comment","In stock","3 available"
dd003e904727281a,"The Exiled",£43.45,Mystery,"In stock","3 available"
b3f2bc2cefb35f05,"The End of Faith: Religion, Terror, and the Future of Reason",£22.13,"Add a comment","In stock","3 available"
c6bf14cb901c63ac,"The Elegant Universe: Superstrings, Hidden Dimensions, and the Quest for the Ultimate Theory",£13.03,Science,"In stock","3 available"
63c0826ef59eae66,"The Disappearing Spoon: And Other True Tales of Madness, Love, and the History of the World from the Periodic Table of the Elements",£57.35,Science,"In stock","3 available"
a6ab0cb7106a67f2,"The Devil Wears Prada (The Devil Wears Prada #1)",£44.29,"Womens Fiction","In stock","3 available"
f51062bf579507d9,"The Demon-Haunted World: Science as a Candle in the Dark",£52.25,Default,"In stock","3 available"
b22362b434e8ee62,"The Day the Crayons Came Home (Crayons)",£26.33,Childrens,"In stock","3 available"
dabf11918b48b40c,"The Da Vinci Code (Robert Langdon #2)",£22.96,Fiction,"In stock","3 available"
1be6d3b121865edb,"The Cuckoo's Calling (Cormoran Strike #1)",£19.21,Mystery,"In stock","3 available"
cad70d6ffd53912f,"The Complete Stories and Poems (The Works of Edgar Allan Poe [Cameo Edition])",£26.78,Classics,"In stock","3 available"
23707d3ddf14a999,"The Complete Poems",£41.32,"Add a comment","In stock","3 available"
487449f4f6322f0f,"The Catcher in the Rye",£24.55,"Add a comment","In stock","3 available"
b7f475238ed50429,"The Cat in the Hat (Beginner Books B-1)",£16.26,Childrens,"In stock","3 available"
970bd3316219e7dc,"The Case for Christ (Cases for Christianity)",£47.84,"Add a comment","In stock","3 available"
a75e274c8814b539,"The Book Thief",£53.49,Default,"In stock","3 available"
08decd9664e5d56e,"The Book of Basketball: The NBA According to The Sports Guy",£44.84,"Sports and Games","In stock","3 available"
cd3dcd83bb002e78,"The Blind Side: Evolution of a Game",£53.71,"Add a comment","In stock","3 available"
b04a6a0db525857d,"The Autobiography of Malcolm X",£23.43,Default,"In stock","3 available"
311634df10651e05,"The Art of Simple Food: Notes, Lessons, and Recipes from a Delicious Revolution",£34.32,"Food and Drink","In stock","3 available"
2858ac90c4758e1f,"The Art of Fielding",£22.10,Fiction,"In stock","3 available"
61002f3b7ba5d780,"Surely You're Joking, Mr. Feynman!: Adventures of a Curious Character",£25.83,Science,"In stock","3 available"
a11ae5f07572ef49,"Stiff: The Curious Lives of Human Cadavers",£36.74,Nonfiction,"In stock","3 available"
f08667e4c0458f37,"Spilled Milk: Based on a True Story",£49.51,Nonfiction,"In stock","3 available"
ac27ab4bcd9c492e,"Something Borrowed (Darcy & Rachel #1)",£48.96,"Womens Fiction","In stock","3 available"
3fc9d51d1c4d6ba7,"Something Blue (Darcy & Rachel #2)",£54.62,"Womens Fiction","In stock","3 available"
feaaae90514eb2ac,"Soldier (Talon #3)",£24.72,Fantasy,"In stock","3 available"
c57d3c96af23c297,"Shopaholic & Baby (Shopaholic #5)",£46.45,Default,"In stock","3 available"
07806456878931bc,"Seven Days in the Art World",£52.33,"Add a comment","In stock","3 available"
281a244ce1954711,"Seven Brief Lessons on Physics",£30.60,Science,"In stock","3 available"
510832818edb6fbc,"Scarlet (The Lunar Chronicles #2)",£14.57,"Young Adult","In stock","3 available"
5b2cd5b31a510848,"Sarah's Key",£46.29,"Add a comment","In stock","3 available"
7b870bf85d01c2dc,"Saga, Volume 3 (Saga (Collected Editions) #3)",£21.57,"Sequential Art","In stock","3 available"
28921443f052bea6,"Running with Scissors",£12.91,Autobiography,"In stock","3 available"
b4f5672f68ec3a83,"Rogue Lawyer (Rogue Lawyer #1)",£50.11,"Add a comment","In stock","3 available"
89cad3f37c9ce226,"Rise of the Rocket Girls: The Women Who Propelled Us, from Missiles to the Moon to Mars",£41.67,Nonfiction,"In stock","3 available"
8e9dd8431170c09e,Rework,£44.88,Business,"In stock","3 available"
ecdf73ee66c33b17,"Reservations for Two",£11.10,Romance,"In stock","3 available"
4c8ece50736f9e88,"Red: The True Story of Red Riding Hood",£28.54,Childrens,"In stock","3 available"
2ef5dc7e278e562a,"Ready Player One",£19.07,"Science Fiction","In stock","3 available"
3c565df219ba3274,"Quiet: The Power of Introverts in a World That Can't Stop Talking",£43.55,Default,"In stock","3 available"
9707989a439757b4,"Prodigy: The Graphic Novel (Legend: The Graphic Novel #2)",£43.63,"Sequential Art","In stock","3 available"
cb62418129b864a3,"Persepolis: The Story of a Childhood (Persepolis #1-2)",£39.13,"Sequential Art","In stock","3 available"
8e2dfd6bcf48e1e6,"Packing for Mars: The Curious Science of Life in the Void",£56.68,Default,"In stock","3 available"
09a7b0b566ad6225,"Outliers: The Story of Success",£14.16,Nonfiction,"In stock","3 available"
c59283b05905c853,"Original Fake",£31.45,"Sequential Art","In stock","3 available"
8378c899988905ee,"Orange Is the New Black",£24.61,Default,"In stock","3 available"
3250650a5c4e6f07,"One for the Money (Stephanie Plum #1)",£32.87,Default,"In stock","3 available"
cb65e49993db9a93,"Notes from a Small Island (Notes From a Small Island #1)",£40.17,Nonfiction,"In stock","3 available"
c4d9fce9eff3b8ba,"Night (The Night Trilogy #1)",£13.51,Nonfiction,"In stock","3 available"
747cf7fca2ccdbd4,"Neither Here nor There: Travels in Europe",£38.95,Travel,"In stock","3 available"
54aeeb4610d3ae08,Naked,£31.69,Humor,"In stock","3 available"
7ce5a92baabb6bc0,"Morning Star (Red Rising #3)",£29.40,Default,"In stock","3 available"
7980fa06f2b704d8,"Miracles from Heaven: A Little Girl, Her Journey to Heaven, and Her Amazing Story of Healing",£57.83,Nonfiction,"In stock","3 available"
e9056f9b5a40a301,"Midnight Riot (Peter Grant/ Rivers of London - books #1)",£55.46,Fantasy,"In stock","3 available"
abc4a7ee16c21088,"Me Talk Pretty One Day",£57.60,Autobiography,"In stock","3 available"
546da23278482b0a,"Manuscript Found in Accra",£34.98,"Add a comment","In stock","3 available"
0dcadb06206abd3c,"Lust & Wonder",£11.87,Autobiography,"In stock","3 available"
4ef75307fb64e2ad,"Lila (Gilead #3)",£12.47,Fiction,"In stock","3 available"
4b3f4f151c99f472,"Life, the Universe and Everything (Hitchhiker's Guide to the Galaxy #3)",£33.26,"Science Fiction","In stock","3 available"
c53d9fefcda371e9,"Life Without a Recipe",£59.04,Autobiography,"In stock","3 available"
4ec53ff7e2263f32,"Life After Life",£26.13,Default,"In stock","3 available"
1de75f05d57bfc10,"Letter to a Christian Nation",£22.20,Nonfiction,"In stock","3 available"
1246e4ffeb5ac4ea,"Let's Pretend This Never Happened: A Mostly True Memoir",£45.11,Nonfiction,"In stock","3 available"
0ce8075fab4a2b5b,"Legend (Legend #1)",£43.69,"Young Adult","In stock","3 available"
d5e1a9bfe22bbf9f,"Lean In: Women, Work, and the Will to Lead",£25.02,Default,"In stock","3 available"
190fbebbf798c31a,"Lamb: The Gospel According to Biff, Christ's Childhood Pal",£55.50,Humor,"In stock","3 available"
16e843e6b853cc2f,"Lady Renegades (Rebel Belle #3)",£53.04,"Young Adult","In stock","3 available"
a0dd11f6abc421ec,"Jurassic Park (Jurassic Park #1)",£44.97,Fiction,"In stock","3 available"
d4a29356fc992879,"It's Never Too Late to Begin Again: Discovering Creativity and Meaning at Midlife and Beyond",£42.38,Nonfiction,"In stock","3 available"
034829ffdd0a0aea,"Is Everyone Hanging Out Without Me? (And Other Concerns)",£20.11,Default,"In stock","3 available"
a7c3f1010d64799a,"Into the Wild",£56.70,Nonfiction,"In stock","3 available"
6c4646d90b60a56c,"Inferno (Robert Langdon #4)",£41.00,Fiction,"In stock","3 available"
d8292cd5f1aca291,"In the Garden of Beasts: Love, Terror, and an American Family in Hitler's Berlin",£28.85,Nonfiction,"In stock","3 available"
61569d12d4ae7161,"If I Run (If I Run #1)",£49.97,"Christian Fiction","In stock","3 available"
6b32b561dab8036c,"I've Got Your Number",£19.69,"Womens Fiction","In stock","3 available"
8010c7c148057fd3,"I Am Malala: The Girl Who Stood Up for Education and Was Shot by the Taliban",£28.88,Nonfiction,"In stock","3 available"
6c4d17a46cac8787,"Hungry Girl Clean & Hungry: Easy All-Natural Recipes for Healthy Eating in the Real World",£33.14,"Food and Drink","In stock","3 available"
1812b8f5641287e3,"House of Lost Worlds: Dinosaurs, Dynasties, and the Story of Life on Earth",£43.70,History,"In stock","3 available"
557c03c284be1bf2,"House of Leaves",£54.89,Horror,"In stock","3 available"
cc1ac978a6835ef6,"Horrible Bear!",£37.52,Childrens,"In stock","3 available"
0cb4856be3694a57,"Holidays on Ice",£51.07,Humor,"In stock","3 available"
b003f8bb02f76dc5,"Heir to the Sky",£44.07,Fantasy,"In stock","3 available"
621e2c310cec8d32,"Green Eggs and Ham (Beginner Books B-16)",£10.79,Childrens,"In stock","3 available"
4f6985aca357ae09,"Grayson, Vol 3: Nemesis (Grayson #3)",£42.72,"Sequential Art","In stock","3 available"
c300cc9326592b65,Gratitude,£26.66,Nonfiction,"In stock","3 available"
d5c588b6f9c015e4,"Gone Girl",£37.60,Default,"In stock","3 available"
984b3b6e7479b571,"Golden (Heart of Dread #3)",£42.21,"Young Adult","In stock","3 available"
41fc5dce044f16f5,"Girl in the Blue Coat",£46.83,"Historical Fiction","In stock","3 available"
d5f5a122a593b580,"Fruits Basket, Vol. 3 (Fruits Basket #3)",£45.17,"Sequential Art","In stock","3 available"
a9aa3ed5b316470b,"Friday Night Lights: A Town, a Team, and a Dream",£51.22,"Sports and Games","In stock","3 available"
2ed3a794a70aa85f,"Fire Bound (Sea Haven/Sisters of the Heart #5)",£21.28,"Add a comment","In stock","3 available"
ed813a848580ba50,"Fifty Shades Freed (Fifty Shades #3)",£15.36,"Adult Fiction","In stock","3 available"
147019cae600694e,Fellside,£38.62,Default,"In stock","3 available"
588ba85ff11a3263,"Extreme Prey (Lucas Davenport #26)",£25.40,Mystery,"In stock","3 available"
b843f52a986a2914,"Eragon (The Inheritance Cycle #1)",£43.87,Fantasy,"In stock","3 available"
73f71f9556442117,"Eclipse (Twilight #3)",£18.74,Default,"In stock","3 available"
36d5884d44484277,"Dune (Dune #1)",£54.86,"Science Fiction","In stock","3 available"
a7ec599c1a547746,Dracula,£52.62,Default,"In stock","3 available"
98330e431e56a9ea,"Do Androids Dream of Electric Sheep? (Blade Runner #1)",£51.48,"Science Fiction","In stock","3 available"
81372abc86f65c79,"Disrupted: My Misadventure in the Start-Up Bubble",£15.28,Nonfiction,"In stock","3 available"
04d858cdeeee0da4,"Dead Wake: The Last Crossing of the Lusitania",£39.24,Default,"In stock","3 available"
d234ddecef49ef4e,"David and Goliath: Underdogs, Misfits, and the Art of Battling Giants",£17.81,Default,"In stock","3 available"
468bd274ac084bb9,"Darkfever (Fever #1)",£56.02,Fantasy,"In stock","3 available"
66937c669c4da072,"Dark Places",£23.90,Default,"In stock","3 available"
c9782ad2a0ed9331,"Crazy Rich Asians (Crazy Rich Asians #1)",£49.13,Fiction,"In stock","3 available"
157f693d9e600ccc,"Counting Thyme",£10.62,Childrens,"In stock","3 available"
dbe33cf29ef1623d,Cosmos,£36.17,"Add a comment","In stock","3 available"
396385e3de5d18c3,"Civilization and Its Discontents",£59.95,Psychology,"In stock","3 available"
7e9579921e5407cb,"Cinder (The Lunar Chronicles #1)",£26.09,"Young Adult","In stock","3 available"
ef49db2aaa9bb547,"Catastrophic Happiness: Finding Joy in Childhood's Messy Years",£37.35,Parenting,"In stock","3 available"
b461cf238506c5b8,"Career of Evil (Cormoran Strike #3)",£24.72,Mystery,"In stock","3 available"
bbfc4a3b7b6c94a0,"Breaking Dawn (Twilight #4)",£35.28,Default,"In stock","3 available"
fd2337c1b73b686e,"Brave Enough",£51.32,Nonfiction,"In stock","3 available"
8e0bc2fe4e7d35b5,"Boy Meets Boy",£21.12,"Young Adult","In stock","3 available"
e256de8aa0c2115f,"Born to Run: A Hidden Tribe, Superathletes, and the Greatest Race the World Has Never Seen",£27.35,Nonfiction,"In stock","3 available"
0bbc48294707ba96,"Blink: The Power of Thinking Without Thinking",£21.74,Nonfiction,"In stock","3 available"
860318b8e244f39c,"Black Flags: The Rise of ISIS",£40.87,Nonfiction,"In stock","3 available"
15f415d436888b2d,"Black Butler, Vol. 1 (Black Butler #1)",£49.31,"Sequential Art","In stock","3 available"
d3f9c4539c0caa64,"Big Little Lies",£22.11,Fiction,"In stock","3 available"
155e42df837ee5ff,"Between Shades of Gray",£20.79,"Historical Fiction","In stock","3 available"
67dea6c75d6a1075,"Best of My Love (Fool's Gold #20)",£27.41,Romance,"In stock","3 available"
3fb69f34e178d494,Beowulf,£38.35,Classics,"In stock","3 available"
5439bae708bca198,"Beautiful Creatures (Caster Chronicles #1)",£21.55,Default,"In stock","3 available"
1d89a2aa9f6ce50f,Awkward,£38.02,"Sequential Art","In stock","3 available"
5d22e2a46604b6e7,Ash,£22.06,Fantasy,"In stock","3 available"
ef9c4f2465513956,"Are We There Yet?",£10.66,Childrens,"In stock","3 available"
da0349a87c8caa2f,"Are We Smart Enough to Know How Smart Animals Are?",£56.58,Nonfiction,"In stock","3 available"
7bf87402413c27ff,"Annie on My Mind",£36.83,"Young Adult","In stock","3 available"
cfe350b20d23b02b,"And Then There Were None",£35.01,Classics,"In stock","3 available"
bcee4f289ff6699c,"A Walk in the Woods: Rediscovering America on the Appalachian Trail",£30.48,Nonfiction,"In stock","3 available"
5dbd6ec4e154ad2f,"A Visit from the Goon Squad",£14.08,Default,"In stock","3 available"
87beabf664115d79,"A Storm of Swords (A Song of Ice and Fire #3)",£31.22,Fantasy,"In stock","3 available"
c9770bb1d5a492a0,"A Heartbreaking Work of Staggering Genius",£54.29,Autobiography,"In stock","3 available"
f5873c8fc7760000,"8 Keys to Mental Health Through Exercise",£31.04,Psychology,"In stock","3 available"
165affa7adb5eded,#GIRLBOSS,£50.96,"Add a comment","In stock","3 available"
d2185b65af52d68c,"The Suffragettes (Little Black Classics, #96)",£11.89,Nonfiction,"In stock","2 available"
4130678275eb7c8c,"The Sense of an Ending",£31.38,"Add a comment","In stock","2 available"
276dc716b1da8899,"The Sandman, Vol. 2: The Doll's House (The Sandman (volumes) #2)",£54.81,"Sequential Art","In stock","2 available"
f3c76b53b239f511,"The Course of Love",£16.78,Fiction,"In stock","2 available"
ce42e3de94226b2b,"Sugar Rush (Offensive Line #2)",£24.42,"Sports and Games","In stock","2 available"
9189fd009df41d0e,"Saga, Volume 2 (Saga (Collected Editions) #2)",£11.75,"Sequential Art","In stock","2 available"
b0e479be03911916,"Run, Spot, Run: The Ethics of Keeping Pets",£20.02,Philosophy,"In stock","2 available"
6fa3ea52c8e31e06,"New Moon (Twilight #2)",£12.86,"Young Adult","In stock","2 available"
637e5a45062aa548,Life,£31.58,Music,"In stock","2 available"
fb495f9f9015a772,"Kindle Paperwhite User's Guide",£34.00,Nonfiction,"In stock","2 available"
b6d3f4f4ee1f6069,"H is for Hawk",£57.42,Nonfiction,"In stock","2 available"
97b8f130d32e9f4e,"Girl Online On Tour (Girl Online #2)",£53.47,"Young Adult","In stock","2 available"
c0db71f6bb14db11,"Fruits Basket, Vol. 2 (Fruits Basket #2)",£11.64,"Sequential Art","In stock","2 available"
d7b463918d3b8c39,"Diary of a Minecraft Zombie Book 1: A Scare of a Dare (An Unofficial Minecraft Book)",£52.88,Childrens,"In stock","2 available"
09d26b5f819c6a36,"Y: The Last Man, Vol. 1: Unmanned (Y: The Last Man #1)",£18.51,"Sequential Art","In stock","1 available"
8ceb5c6aed2c5f8b,"While You Were Mine",£41.32,"Historical Fiction","In stock","1 available"
def389ddfda6991b,"Where Lightning Strikes (Bleeding Stars #3)",£39.77,Romance,"In stock","1 available"
c5f91eb481427dc5,"When I'm Gone",£51.96,Fiction,"In stock","1 available"
66a4e422b212726a,"Ways of Seeing",£39.51,Art,"In stock","1 available"
e7e87087b1a44711,"Vampire Knight, Vol. 1 (Vampire Knight #1)",£15.40,Paranormal,"In stock","1 available"
dab5e75d1339706a,"Vampire Girl (Vampire Girl #1)",£53.82,Fantasy,"In stock","1 available"
e63c3f25338baf9a,"Twenty Love Poems and a Song of Despair",£30.95,Poetry,"In stock","1 available"
0268f149d014b389,"Travels with Charley: In Search of America",£57.82,Nonfiction,"In stock","1 available"
460f97a346b44bac,"Three Wishes (River of Time: California #1)",£44.18,"Science Fiction","In stock","1 available"
d6d98d3508c30f57,"This One Moment (Pushing Limits #1)",£48.71,Romance,"In stock","1 available"
9c96cd1329fbd82d,"The Zombie Room",£19.69,Default,"In stock","1 available"
dac9d1e654fac737,"The Wicked + The Divine, Vol. 1: The Faust Act (The Wicked + The Divine)",£36.52,"Sequential Art","In stock","1 available"
6514add13c82b115,"The Tumor",£41.56,Nonfiction,"In stock","1 available"
32d035df92ab9080,"The Story of Hong Gildong",£43.19,Classics,"In stock","1 available"
b78deb463531d078,"The Silent Wife",£12.34,Fiction,"In stock","1 available"
9e9932ae1a7d0943,"The Silent Twin (Detective Jennifer Knight #3)",£36.25,Fantasy,"In stock","1 available"
6f2c0a9adbb2bca9,"The Selfish Gene",£29.45,Science,"In stock","1 available"
38f776ab9118aed7,"The Secret Healer",£34.56,"Historical Fiction","In stock","1 available"
5faefdc861684eb1,"The Sandman, Vol. 1: Preludes and Nocturnes (The Sandman (volumes) #1)",£54.12,"Sequential Art","In stock","1 available"
0ec9d2b018fb10d8,"The Republic",£33.78,"Add a comment","In stock","1 available"
f0512adadffd2480,"The Odyssey",£29.64,"Add a comment","In stock","1 available"
b0913e67d38d5ed5,"The No. 1 Ladies' Detective Agency (No. 1 Ladies' Detective Agency #1)",£57.70,Mystery,"In stock","1 available"
5c10b64db3e4f228,"The Nicomachean Ethics",£36.34,Philosophy,"In stock","1 available"
c8614adb1a90b027,"The Name of the Wind (The Kingkiller Chronicle #1)",£50.59,Default,"In stock","1 available"
c40b70e0f6d80189,"The Mirror & the Maze (The Wrath and the Dawn #1.5)",£29.38,Fantasy,"In stock","1 available"
1aeca7d078d57deb,"The Little Prince",£45.42,Classics,"In stock","1 available"
04e43893e32f9d29,"The Light of the Fireflies",£54.43,"Add a comment","In stock","1 available"
16c71736dae78764,"The Last Girl (The Dominion Trilogy #1)",£36.26,"Science Fiction","In stock","1 available"
86d8bd7afa5b51b3,"The Iliad",£16.16,"Add a comment","In stock","1 available"
6e473eff459e809f,"The Hook Up (Game On #1)",£36.29,"New Adult","In stock","1 available"
fff8a057a40c4a60,"The Haters",£27.89,"Young Adult","In stock","1 available"
4280ac3eab57aa5d,"The Girl You Lost",£12.29,Mystery,"In stock","1 available"
ee61197edb882599,"The Girl In The Ice (DCI Erika Foster #1)",£15.85,Mystery,"In stock","1 available"
09659d1639a1f978,"The End of the Jesus Era (An Investigation #1)",£14.40,Nonfiction,"In stock","1 available"
29fc016c459aeb14,"The Edge of Reason (Bridget Jones #2)",£19.18,"Womens Fiction","In stock","1 available"
3301af038a720587,"The Complete Maus (Maus #1-2)",£10.64,"Sequential Art","In stock","1 available"
18b4545a5ed15581,"The Communist Manifesto",£14.76,"Add a comment","In stock","1 available"
f3a0b8c835129558,"The Bhagavad Gita",£57.49,Religion,"In stock","1 available"
dfb0849016bc122c,"The Bette Davis Club",£30.66,Fiction,"In stock","1 available"
5bc1fbccfbf2355c,"The Art of Not Breathing",£40.83,"Young Adult","In stock","1 available"
a7eef9d6795422c1,"Taking Shots (Assassins #1)",£18.88,Default,"In stock","1 available"
e25164e5b3fe208b,Starlark,£25.83,"Historical Fiction","In stock","1 available"
2ac720f76384c57e,"Skip Beat!, Vol. 01 (Skip Beat! #1)",£42.12,"Sequential Art","In stock","1 available"
3a9a7c5895e82646,"Sister Sable (The Mad Queen #1)",£13.33,Fantasy,"In stock","1 available"
9ed7090d8fa690b0,"Shatter Me (Shatter Me #1)",£42.40,Default,"In stock","1 available"
c068c013d6921fea,Shameless,£58.35,"New Adult","In stock","1 available"
229cd6564bf0dce4,"Shadow Rites (Jane Yellowrock #10)",£21.72,Fantasy,"In stock","1 available"
132adf7335bb384a,"Settling the Score (The Summer Games #1)",£44.91,"Sports and Games","In stock","1 available"
35e44170702139a4,"Sense and Sensibility",£37.46,Classics,"In stock","1 available"
4f64568dfefa3ce7,"Saga, Volume 1 (Saga (Collected Editions) #1)",£28.48,"Sequential Art","In stock","1 available"
9efb397067eb7e8a,"Rhythm, Chord & Malykhin",£28.34,Romance,"In stock","1 available"
3cdca3b4a93980f5,"Rat Queens, Vol. 1: Sass & Sorcery (Rat Queens (Collected Editions) #1-5)",£46.96,"Sequential Art","In stock","1 available"
849db7ab7f4a640c,"Paradise Lost (Paradise #1)",£24.96,Default,"In stock","1 available"
bcbcbcf0f6ed196f,"Paper Girls, Vol. 1 (Paper Girls #1-5)",£21.71,"Sequential Art","In stock","1 available"
326825e02a198cf6,"Ouran High School Host Club, Vol. 1 (Ouran High School Host Club #1)",£29.87,"Sequential Art","In stock","1 available"
8932e5c12f12ffed,"Origins (Alphas 0.5)",£28.99,Fantasy,"In stock","1 available"
7ea31f38675b91c1,"One Second (Seven #7)",£52.94,Fantasy,"In stock","1 available"
9ff997ab15713e53,"On the Road (Duluoz Legend)",£32.36,Default,"In stock","1 available"
a1985630339f4b3d,"Old Records Never Die: One Man's Quest for His Vinyl and His Past",£55.66,Music,"In stock","1 available"
b6f1cfadc4dd79d4,"Off Sides (Off #1)",£39.45,"New Adult","In stock","1 available"
39592d9d72e717c4,"Of Mice and Men",£47.11,Classics,"In stock","1 available"
63e20a0f98218a87,"Myriad (Prentor #1)",£58.75,Fantasy,"In stock","1 available"
fd78f89878479f56,"My Perfect Mistake (Over the Top #1)",£38.92,Romance,"In stock","1 available"
35a60467893aa168,"Ms. Marvel, Vol. 1: No Normal (Ms. Marvel (2014-2015) #1)",£39.39,"Sequential Art","In stock","1 available"
4f19709e47883df5,Meditations,£25.89,Philosophy,"In stock","1 available"
1053fb7ee17a1f33,Matilda,£28.34,Childrens,"In stock","1 available"
d510567580c8be52,"Lost Among the Living",£27.70,"Historical Fiction","In stock","1 available"
71a6471bbdac21d9,"Lord of the Flies",£24.89,"Add a comment","In stock","1 available"
6e712ea24e77bd96,"Listen to Me (Fusion #1)",£58.99,Romance,"In stock","1 available"
06f6a57a6d532844,"Kitchens of the Great Midwest",£57.20,Fiction,"In stock","1 available"
8d390a1fc3133d06,"Jane Eyre",£38.43,Default,"In stock","1 available"
f28f7299d38c0932,"Imperfect Harmony",£34.74,Romance,"In stock","1 available"
3455b45888fb5053,"Icing (Aces Hockey #2)",£40.44,"Sports and Games","In stock","1 available"
6fe02600f322a0a9,"Hawkeye, Vol. 1: My Life as a Weapon (Hawkeye #1)",£45.24,"Sequential Art","In stock","1 available"
6717a70913b3db79,"Having the Barbarian's Baby (Ice Planet Barbarians #7.5)",£34.96,"Science Fiction","In stock","1 available"
eb0fe24bbc845ecc,"Giant Days, Vol. 1 (Giant Days #1-4)",£56.76,"Sequential Art","In stock","1 available"
72e6fbf4f6382557,"Fruits Basket, Vol. 1 (Fruits Basket #1)",£40.28,"Sequential Art","In stock","1 available"
a492f49a3e2b6a71,Frankenstein,£38.00,Default,"In stock","1 available"
e564c3f1a93ccf2e,"Forever Rockers (The Rocker #12)",£28.80,Music,"In stock","1 available"
6390772a3094939d,"Fighting Fate (Fighting #6)",£39.24,Romance,"In stock","1 available"
2e69730561ed70ad,Emma,£32.93,Classics,"In stock","1 available"
df56868afd166557,"Eat, Pray, Love",£51.32,Nonfiction,"In stock","1 available"
0072b94dfa30608e,"Deep Under (Walker Security #1)",£47.09,Romance,"In stock","1 available"
a812f6969ddf3e39,"Choosing Our Religion: The Spiritual Lives of America's Nones",£28.42,Religion,"In stock","1 available"
1774749f2cee292f,"Charlie and the Chocolate Factory (Charlie Bucket #1)",£22.85,Childrens,"In stock","1 available"
a96404cb928895f3,"Charity's Cross (Charles Towne Belles #4)",£41.24,Romance,"In stock","1 available"
230ac636ea0ea415,"Bright Lines",£39.07,Fiction,"In stock","1 available"
a2b4b685dfa94733,"Bridget Jones's Diary (Bridget Jones #1)",£29.82,"Womens Fiction","In stock","1 available"
abc0b15f2c907ff0,"Bounty (Colorado Mountain #7)",£37.26,Romance,"In stock","1 available"
95cdfd514098c38b,"Blood Defense (Samantha Brinkman #1)",£20.30,Mystery,"In stock","1 available"
099fae4a0705d63b,"Bleach, Vol. 1: Strawberry and the Soul Reapers (Bleach #1)",£34.65,"Sequential Art","In stock","1 available"
08672cd59171d5e4,"Beyond Good and Evil",£43.38,Philosophy,"In stock","1 available"
cd2a2a70dd5d176d,"Alice in Wonderland (Alice's Adventures in Wonderland #1)",£55.53,Classics,"In stock","1 available"
bfd5e1701c862ac3,"Ajin: Demi-Human, Volume 1 (Ajin: Demi-Human #1)",£57.06,"Sequential Art","In stock","1 available"
19fec36a1dfb4c16,"A Spy's Devotion (The Regency Spies of London #1)",£16.97,"Historical Fiction","In stock","1 available"
f684a82adc49f011,"1st to Die (Women's Murder Club #1)",£53.98,Mystery,"In stock","1 available"
228ba5e7577e1d49,"1,000 Places to See Before You Die",£26.08,Travel,"In stock","1 available"
